Title,Rating,Price,Price_Anterior,Votante,Demanda
"waveshare Pantalla HDMI LCD IPS de 4 pulgadas, resolución 800x480, interfaz de pantalla táctil resistente para Raspberry Pi 4 B/3 B/3 B+/2 B/B+/B Zero W",4.1,38.,,(115),
"FYHXele Monitor para juegos, monitor 4K de 144 Hz de 28 pulgadas con control remoto, monitor de computadora UHD IPS, 65 W USB-C, 1 ms, montaje VESA, altavoz dual, sincronización libre, DSC, 1 HDMI2.1, 1 HDMI2.0, entradas 1 DisplayPort1.4, HDR400",4.0,529.,US$729.99US$729.99,(93),Solo queda(n) 17 en stock (hay más unidades en camino).
"ASUS Monitor de acoplamiento 1080P de 23.8 pulgadas (VA24ECPSN) - Full HD, IPS, 75Hz, sincronización adaptativa, altavoces, cuidado de los ojos, luz azul baja, sin parpadeo, USB-C, RJ45, HDMI, sin marco, ajuste de altura, montaje en pared VESA",5.0,169.,,(5),
"Dragon Touch Portátil 4K – Monitor de juegos IPS HDR de 15.6 pulgadas, 100% sRGB FreeSync con altavoces, VESA compatible con Xbox PS4 Nintendo Switch, laptop, PC, teléfono, Mac Surface (no pantalla táctil)",4.2,224.,US$299.99US$299.99,(485),
"HONGO Monitor portátil para portátil de 15.6 pulgadas, Full HD 1080P, monitor de computadora dual USB C HDMI con altavoces, monitor de viaje plano para MacBook Pro PS4 PS5 PC, cubierta inteligente y protector de pantalla incluidos",4.3,119.,,"(1,180)",
"Sceptre Monitor para juegos de 27 pulgadas 240Hz 1080p AMD FreeSync Premium HDMI DisplayPort, altavoces integrados ajustables en altura negro Gunmetal (E275B-FWD240)",4.6,199.,US$249.97US$249.97,(499),
LG 34WQ75C-B.AUS Curvo UltraWide™ QHD IPS HDR 10 Monitor KVM integrado con USB Type-C™ y LAN (RJ-45),2.8,496.,US$599.99US$599.99,(5),
"Dell P2423DE Monitor LCD QHD WLED de 23.8 pulgadas - 16:9 - Negro, plateado",No hay opiniones,389.,US$529.99US$529.99,,
"LG Monitor ultra ancho WFHD IPS de 29 pulgadas, altavoces duales, 2560x1080, 99% sRGB, HDR10, FreeSync, 21 9, montaje en pared, paquete de frecuencia de actualización de 75Hz con JAWFOAL",4.5,299.,,(40),Solo queda(n) 16 en stock (hay más unidades en camino).
"CASKING Monitor portátil FHD de 15.6 pulgadas, monitor portátil con pantalla táctil 1080P IPS, monitor de viaje para laptop, Mac, PS5, interruptor, Xbox, teléfono con 10 puntos táctil, laminación completa G+FF, HDMI, USB-C, cubierta inteligente",3.8,199.,,(4),
"WIMAXIT Monitor portátil de 12 pulgadas, pantalla táctil USB tipo C, pantalla IPS con 1366 x 768 mini altavoces HDMI USB-C para laptop, PC, computadora, PS4, Xbox Phone",4.2,139.,,(60),
"UPERFECT S Sensor de gravedad de 15.6 pulgadas, pantalla táctil dual UHD 3840x2160, pantalla táctil dual USB C de 10 puntos integrado y sin marco, pantalla HD de vidrio para portátil",4.4,599.,US$699.99US$699.99,(478),
"MSI G2712, monitor para juegos de 27 pulgadas, 1920 x 1080 (FHD), IPS, 1ms, 170Hz, FreeSync Premium, HDMI, Displayport, Tilt",5.0,179.,US$219.99US$219.99,(1),Sólo hay 16 disponible(s).
"ROADOM Monitor portátil 4K de 15.6 pulgadas 3840 x 2160 UHD Dual USB-C Laptop Monitor, monitor de juego 100% sRGB, 400 cd/㎡ HDR FreeSync, pantalla de computadora IPS cubierta de altavoz para Mac, laptop, PC, teléfono, PS5 Xbox Switch",4.3,239.,US$299.99US$299.99,(89),
"Panel de pantalla colgante de privacidad para computadora, compatible con monitor de computadora de escritorio de 23 pulgadas, 23.6 pulgadas, 23.8 pulgadas, 24 pulgadas, protección ocular anti-UV, relación de aspecto 16:9/16:10 (ancho 21.2 pulgadas x alto 13.4 pulgadas)",4.4,82.,,(72),
"Lenovo ThinkVision T32h-20 31.5"" WQHD WLED LCD Monitor - 16:9 - Raven Black",5.0,,,(5),
"Belkin Cable Thunderbolt 3 Dock Plus Thunderbolt 3 - Hub USB C - Estación de acoplamiento 8 en 1 para MacOS y Windows, 4K dual a 60Hz, velocidad de transferencia de 40 Gbps, carga ascendente de 60 W, con puertos Ethernet y audio",3.4,209.,US$299.99US$299.99,(135),
"Monitor de pantalla táctil portátil: Aekegrep, pantalla táctil, monitor portátil USB-C de 15.6 pulgadas, 1080P FHD de 15.6 pulgadas, vista completa de 178°, para Android Xbox Switch PS5 Raspberry Pi. Monitor portátil",5.0,180.,,(3),
"Kantek MAXVIEW - Lupa de monitor LCD para monitores de pantalla ancha de 24 pulgadas (medido diagonalmente) (MAG24WL), transparente",3.3,118.,,(850),
"VIOTEK GFV24CB - Monitor de juego de 24 pulgadas, 165 Hz (soporta 144 Hz) 1920 x 1080p FHD de alto color 4000:1, contraste 98 % sRGB VA, Panel pantalla cerca de marco sin bisel GSYNC, FreeSync, DisplayPort, HDMI, VESA",4.6,119.,US$179.99US$179.99,(857),
"Sceptre - Monitor curvo de 24 pulgadas, 75Hz, LED, para videojuegos, Full HD, 1080P, HDMI, VGA, con altavoces, montaje de pared VESA listo para usar, metal negro (C248W-1920RN)",4.6,109.,,"(17,410)",
"Z-Edge - Monitor curvado para juegos de 32 pulgadas 16:9 1920x1080 180Hz 1ms Monitor LED sin marco, AMD Freesync Premium Display Port HDMI Altavoces integrados",4.5,239.,US$299.99US$299.99,(194),
"WESTHOD Extensor de monitor portátil de 12 pulgadas, monitor portátil para laptop, HDMI, USB C, doble pantalla, FHD 1080P, Plug-Play Tri-SScreen para Windows, Chrome, Mac e Switch, funciona con portátiles de 13 a 16 pulgadas",4.2,319.,US$399.00US$399.00,(760),
"ZSCMALLS Monitor portátil de 15.6 pulgadas, pantalla de computadora Full HD USB C Dual Monitor con altavoz, monitor de juegos para PS3 PS4 Xbox Nintendo Raspberry pi",4.3,129.,,"(3,597)",
"HP Computadora de escritorio todo en uno, pantalla FHD de 22 pulgadas, Intel Celeron G5900T, DVD-Writer, 4 puertos USB, AC WiFi, HDMI, Bluetooth, Windows 11 Home (22, 16 GB de RAM | SSD de 512 GB, azul)",4.5,499.,,(11),Solo queda(n) 17 en stock (hay más unidades en camino).
LG Monitor 22MN430M-B Pantalla IPS Full HD de 22 pulgadas con FreeSync - Negro,4.6,141.,,(245),
"OUNSHLI Monitor portátil de doble pantalla para portátil de 14 pulgadas, pantalla HDMI USB C FHD 1080P HDR ISP con teclado de batería, segundo monitor para MacBook Pro (ONS-T14B)",4.3,159.,US$239.99US$239.99,(11),
"Dell Laptop Inspiron 15 serie 3000 2022, pantalla táctil FHD de 15.6 pulgadas, antirreflejos, procesador Intel Core i5-1035G1 de 10ª generación, procesador de cuatro núcleos, 16 GB de RAM, 1 TB PCIe SSD, HDMI, cámara web, Windows 11, negro",4.6,639.,,(40),Solo queda(n) 14 en stock (hay más unidades en camino).
"Dell Monitor de 24 pulgadas 2021 FHD 16:9 con Comfortview (certificado UV), frecuencia de actualización de 75 Hz, 16.7 millones de colores, antirreflejos con dureza 3H, negro (paquete de 1)",4.5,197.,US$399.00US$399.00,(33),Solo queda(n) 15 en stock (hay más unidades en camino).
"FormulaMod Monitor de temperatura de 8.8 pulgadas, pantalla de expansión externa, pantalla LCD de alta resolución para PC, ARGB, carcasa de computadora, pantalla secundaria",4.4,152.,,(53),Solo queda(n) 6 en stock (hay más unidades en camino).
"BenQ SW240 WUXGA IPS Monitor de computadora de 24 pulgadas para edición de fotos con 99% Adobe RGB, 100% sRGB, 95% DCI-P3 con informe de calibración de fábrica, profundidad de color de 10 bits con calibración de hardware 3D LUT de 14 bits",4.5,399.,,(575),Solo queda(n) 9 en stock (hay más unidades en camino).
"Kenowa Monitor portátil de 13.3 pulgadas, pantalla de PC 16:9 con pantalla externa HDMI VGA para computadora/laptop/Raspberry Pi / PS3/PS4 Xbox, carcasa de aluminio, resolución HD de 1366 x 768 60 HZ",4.0,79.,US$95.99US$95.99,(349),
"HP Z24n G3 - Monitor LCD LED WUXGA de 24 pulgadas, 16:9, color plateado",5.0,324.,,(1),Sólo hay 16 disponible(s).
"Z-Edge - Monitor portátil para laptop, monitor portátil ultradelgado de 15.6 pulgadas con tipo C, pantalla IPS Full HD de 1920 × 1080 USB C, monitor secundario y pantalla para PC MAC teléfono Switch Xbox PS4",4.5,129.,,(336),
"ViewSonic OMNI XG2705-2K 27 pulgadas 1440p 1ms 144Hz IPS Monitor para juegos con FreeSync Premium, cuidado de los ojos, ergonomía avanzada, HDMI y DP para deportes electrónicos",4.7,369.,,(203),Solo queda(n) 9 en stock (hay más unidades en camino).
Monitor UltraGear QHD 165Hz HDR10 de 32 pulgadas con compatibilidad NVIDIA G-SYNC y AMD FreeSync Premium,4.5,324.,,(37),Solo queda(n) 10 en stock (hay más unidades en camino).
"Dragon Touch Portátil 4K – Monitor de juegos IPS HDR de 15.6 pulgadas, 100% sRGB FreeSync con altavoces, VESA compatible con Xbox PS4 Nintendo Switch, laptop, PC, teléfono, Mac Surface (no pantalla táctil)",4.2,224.,US$299.99US$299.99,(485),
"HONGO Monitor portátil para portátil de 15.6 pulgadas, Full HD 1080P, monitor de computadora dual USB C HDMI con altavoces, monitor de viaje plano para MacBook Pro PS4 PS5 PC, cubierta inteligente y protector de pantalla incluidos",4.3,119.,,"(1,180)",
"VIOTEK GFV24CB - Monitor de juego de 24 pulgadas, 165 Hz (soporta 144 Hz) 1920 x 1080p FHD de alto color 4000:1, contraste 98 % sRGB VA, Panel pantalla cerca de marco sin bisel GSYNC, FreeSync, DisplayPort, HDMI, VESA",4.6,119.,US$179.99US$179.99,(857),
"VINTEZ Filtro de pantalla de privacidad para computadora de 28 pulgadas para monitor de computadora de pantalla ancha 16:9, antirreflejos, película protectora antiarañazos, escudo de confidencialidad de datos",3.9,68.,,(301),
"Westinghouse Monitor curvado para juegos de 27 pulgadas de 144 Hz - Full HD (1920 x 1080) AMD FreeSync con relación de aspecto 16:9, 16.7 millones de colores de pantalla, 2 entradas HDMI, entrada/salida USB 3.0",4.5,249.,US$299.99US$299.99,(387),Solo queda(n) 13 en stock (hay más unidades en camino).
"SAMSUNG UR59 Series - Monitor de computadora 4K UHD (3840x2160), curvado, HDMI, puerto de pantalla, sin bordes de 3 lados, modo protector de ojos (LU32R591CWNXZA) + paño de limpieza Wacky Jacky",4.1,,,(10),
"Acer Nitro XV272U KFbmiipruzx 27"" WQHD 2560 x 1440 Monitor para juegos | AMD FreeSync Premium | Agile-Splendor IPS 600 | Frecuencia de actualización de 300Hz | Hasta 0.5ms | USB 3.1 Tipo C, puerto de pantalla y 2 x HDMI 2.1",3.9,875.,,(21),
CORSAIR Elite Capellix CW-9060056-WW - Kit de pantalla LCD dedicada para enfriador de CPU,4.0,99.,,(78),
"Sceptre Monitor IPS ultraancho de 29 pulgadas 2560 x 1080 75Hz HDMI DisplayPort 119% sRGB hasta 300 Lux altavoces integrados, color negro máquina (E300W-FUS)",4.5,149.,US$209.97US$209.97,(36),
"MSI MPG341QR, monitor de juegos de 34 pulgadas, 3440 x 1440 (UWQHD), IPS, 1ms, 144Hz, compatible con G-Sync, HDR 400, HDMI, Displayport, USB tipo C, inclinación, giratorio, altura ajustable",4.1,512.,US$599.99US$599.99,(41),Solo queda(n) 2 en stock (hay más unidades en camino).
"SunFounder Raspberry Pi - Pantalla táctil capacitiva de 7 pulgadas, pantalla IPS LCD, compatible con HDMI USB-C para Raspberry Pi 4B 3B+ 2 ventanas modelo B con soporte",4.4,79.,,(181),
"VSDISPLAY HD-MI VGA DVI Audio LVDs Tablero de controlador de 30 pines para 17"" 19"" 1280x1024 M170EG01 M170EN01 M170EN06 M170ETN01 1 panel de pantalla LCD para juegos",4.7,29.,,"(1,156)",
"MSI Pro MP241C, 24"", 1920 x 1080 (FHD), VA curvado, 75Hz, FreeSync, protección ocular certificada TUV, 1 ms, HDMI, inclinación",4.2,99.,US$139.99US$139.99,(22),
"Kwumsy P2 Pro - Extensor de pantalla portátil triple de 13.3 pulgadas, pantalla externa multifunción FHD IPS tipo C, extensor de monitor múltiple compatible con chips Mac M1 de 13.3 a 16.5 pulgadas",4.0,599.,,(86),
"LG 32BL95U-W 32"" LED LCD Monitor - 16: 9-3840 X 2160-450 Nit - 4K UHD - Altavoces - HDMI - DisplayPort - USB, Negro",4.3,,,(24),
"BenQ PD3200U Monitor de computadora profesional 4K UHD IPS calibrado de fábrica AQCOLOR para diseñadores con interruptor KVM integrado, 100% Rec.709, sRGB, DualView, diseño ergonómico, tecnología de cuidado ocular",4.5,629.,US$899.00US$899.00,"(2,837)",
"BenQ - Monitor de computadora GL2780 de 27 pulgadas, 1080P FHD 75Hz 1ms para juegos con tecnología patentada de cuidado ocular y brillo adaptable para calidad de imagen y listo para VESA",4.7,149.,US$209.99US$209.99,"(24,028)",Solo queda(n) 3 en stock (hay más unidades en camino).
"Packard Bell AirFrame - Paquete de 2 monitores de escritorio con bisel ultra delgado de 24 pulgadas, FHD 1920 x 1080p, 75 Hertz, 5 milisegundos, montaje VESA, ajuste de inclinación, HDMI y VGA para uso doméstico y oficina",4.1,249.,,(374),
"Z-Edge - Monitor curvado para juegos de 32 pulgadas 16:9 1920x1080 180Hz 1ms Monitor LED sin marco, AMD Freesync Premium Display Port HDMI Altavoces integrados",4.5,239.,US$299.99US$299.99,(194),
"WESTHOD Extensor de monitor portátil de 12 pulgadas, monitor portátil para laptop, HDMI, USB C, doble pantalla, FHD 1080P, Plug-Play Tri-SScreen para Windows, Chrome, Mac e Switch, funciona con portátiles de 13 a 16 pulgadas",4.2,319.,US$399.00US$399.00,(760),
"ZSCMALLS Monitor portátil de 15.6 pulgadas, pantalla de computadora Full HD USB C Dual Monitor con altavoz, monitor de juegos para PS3 PS4 Xbox Nintendo Raspberry pi",4.3,129.,,"(3,597)",
"AOC - Monitor para videojuegos, curvado, sin marco, FHD 1ms VA",4.6,,,"(2,483)",
"Ruvihya - Monitor portátil con pantalla táctil, pantalla táctil portátil de 15.6 pulgadas, 1080P de 10 puntos, 100% sRGB dual USB-3.0 tipo C HDMI para cuidado de los ojos, monitor de viaje táctil para laptop, PC, teléfono con altavoces incorporados, cubierta inteligente",4.3,219.,US$259.99US$259.99,(51),
"Dell - Monitor de juegos curvado FHD LED de 24 pulgadas (HDMI 2.0, puerto de pantalla 1.2) - negro (S2422HG)",4.6,185.,,(34),Solo queda(n) 14 en stock (hay más unidades en camino).
"ZSCMALLS Monitor portátil de 15.6 pulgadas Full HD 1080p HDR, monitor de juegos USB tipo C Mini HDMI pantalla IPS con altavoces estéreo para PS3, PS4, Xbox, Raspberry Pi, laptop, PC, MAC rojo",4.3,119.,,(93),
"WESTREE Soporte elevador de monitor doble con cajón de 3 estantes, elevador de monitor de computadora, plataforma de escritorio para computadora con longitud y ángulo ajustables, suministros de accesorios de escritorio para oficina en casa, color blanco",4.5,39.,,(95),
Acer Monitor LCD LED UHD V287K de 28 pulgadas 4K - 16:9 - Negro - Clase de 28 pulgadas - Tecnología de conmutación en plano (IPS) - 3840 x 2160-1.07 mil millones de colores - Sincronización adaptable (DisplayPort/HDMI) - 300 Nit - 4 ms,3.7,,,(9),
"ROADOM Monitor portátil 4K de 15.6 pulgadas 3840 x 2160 UHD Dual USB-C Laptop Monitor, monitor de juego 100% sRGB, 400 cd/㎡ HDR FreeSync, pantalla de computadora IPS cubierta de altavoz para Mac, laptop, PC, teléfono, PS5 Xbox Switch",4.3,239.,US$299.99US$299.99,(89),
"Temtop M10 Monitor de calidad de aire para PM2.5 HCHO TVOC AQI Detector de sensor electroquímico profesional Pantalla en tiempo real Batería recargable, P10",3.9,49.,,(947),
"Monitor de 23.8 pulgadas, monitor de computadora IPS de 75 Hz FHD (1920 x 1080) con ángulo de visión amplio de 178°, montaje sin marco y VESA, pantalla ELED, inclinación ergonómica, modo de cuidado de ojos de luz azul baja (puerto HDMI y VGA)",4.4,78.,US$82.99US$82.99,(6),
"Eyoyo Monitor portátil, pequeño monitor USB C de 10.5 pulgadas, FHD 1920x1280 segundo monitor para portátil 100% SRGB portátil IPS Monitor HDMI para juegos",4.6,119.,,(12),Solo queda(n) 18 en stock (hay más unidades en camino).
"G-STORY Monitor portátil con pantalla táctil de 15.6 pulgadas, 1080P Full HD IPS Gaming Display USB-C Monitor portátil para juegos con HDR/FreeSync/Altavoces/Mini HDMI para PS5 PS4 Xbox Series NS, laptop, PC, teléfono MAC",3.8,199.,,(93),
"FormulaMod Monitor de temperatura de 8.8 pulgadas, pantalla de expansión externa, pantalla LCD de alta resolución para PC, ARGB, carcasa de computadora, pantalla secundaria",4.4,152.,,(53),Solo queda(n) 6 en stock (hay más unidades en camino).
"Dragon Touch Portátil 4K – Monitor de juegos IPS HDR de 15.6 pulgadas, 100% sRGB FreeSync con altavoces, VESA compatible con Xbox PS4 Nintendo Switch, laptop, PC, teléfono, Mac Surface (no pantalla táctil)",4.2,224.,US$299.99US$299.99,(485),
"HONGO Monitor portátil para portátil de 15.6 pulgadas, Full HD 1080P, monitor de computadora dual USB C HDMI con altavoces, monitor de viaje plano para MacBook Pro PS4 PS5 PC, cubierta inteligente y protector de pantalla incluidos",4.3,119.,,"(1,180)",
"VIOTEK GFV24CB - Monitor de juego de 24 pulgadas, 165 Hz (soporta 144 Hz) 1920 x 1080p FHD de alto color 4000:1, contraste 98 % sRGB VA, Panel pantalla cerca de marco sin bisel GSYNC, FreeSync, DisplayPort, HDMI, VESA",4.6,119.,US$179.99US$179.99,(857),
"MSI MPG ARTYMIS 343CQR, monitor de juegos de 34 pulgadas, 3440 x 1440 (UWQHD), VA, 165Hz, FreeSync Premium, HDR 400, HDMI, Displayport, USB C, inclinación, giratorio, altura ajustable",4.4,599.,US$899.99US$899.99,(67),
"MSI Moderna MD241P, 24"", 1920 x 1080 (FHD), IPS, 75Hz, protección ocular certificada TUV, 5ms, HDMI, USB C, inclinación, giratorio, altura ajustable, pivotante",4.4,149.,US$169.99US$169.99,(41),Solo queda(n) 9 en stock (hay más unidades en camino).
"HP E24i G4 - Monitor LCD LED WUXGA de 24 pulgadas, 16:10, negro, plateado",4.3,241.,US$304.00US$304.00,(7),
"Feihe Monitor Full HD de 15 pulgadas, monitor LED de 1920 x 1200 con altavoces integrados HDMI VGA, frecuencia de actualización de 60 Hz, tiempo de respuesta de 5 ms, montaje VESA",3.7,105.,,(19),Solo queda(n) 12 en stock (hay más unidades en camino).
"Miktver Monitor pequeño de 10.5 pulgadas, resolución FHD 1920x1280, pantalla de pantalla Raspberry Pi, pantalla IPS portátil para juegos",4.8,119.,US$129.99US$129.99,(9),Solo queda(n) 20 en stock (hay más unidades en camino).
"Módulo IPS LCD redondo de 1.28 pulgadas, resolución de 240 x 240 pulgadas, interfaz SPI de 65 K, colores RGB para Arduino/Raspberry Pi/Jetson Nano/STM32",4.3,20.,,(61),
"LG 24GN600-B - Monitor para videojuegos sin marco, 23,8 pulgadas, Full HD, IPS, 144 Hz, 1 ms (GtoG), FreeSync Premium, HDR, HDMI x 2, DP (renovado)",4.7,159.,US$203.98US$203.98,(53),
Viewedge Monitor de 24 pulgadas - Monitor de PC de 24 pulgadas con pantalla VA de 1080p 75 Hz 5 ms - Monitor de computadora diseñado con bisel ultrafino - Protección ocular (filtro de luz azul y sin parpadeo) HDMI para oficina y juegos,4.5,129.,,(19),Solo queda(n) 12 en stock (hay más unidades en camino).
"LG 27GP750-B Monitor de juegos Ultragear FHD (1920 x 1080) IPS con tiempo de respuesta de 1 ms y frecuencia de actualización de 240 Hz, NVIDIA G-SYNC compatible con AMD FreeSync Premium, bisel delgado, inclinación/altura/pivote ajustable",4.7,,,"(1,111)",
Monitor UltraGear QHD 165Hz HDR10 de 32 pulgadas con compatibilidad NVIDIA G-SYNC y AMD FreeSync Premium,4.5,324.,,(37),Solo queda(n) 10 en stock (hay más unidades en camino).
"Eyoyo - Monitor portátil, pantalla táctil de 11.6 pulgadas, pantalla de computadora portátil de 1366 x 768 pulgadas, monitor portátil USB C HDMI, monitor de ojos con pantalla IPS de 178°, monitor externo para laptop, PC, teléfono, Mac, Xbox PS4",3.9,127.,US$149.99US$149.99,(21),Solo queda(n) 14 en stock (hay más unidades en camino).
"VINTEZ Filtro de pantalla de privacidad para computadora de 28 pulgadas para monitor de computadora de pantalla ancha 16:9, antirreflejos, película protectora antiarañazos, escudo de confidencialidad de datos",3.9,68.,,(301),
"BenQ PD3200U Monitor de computadora profesional 4K UHD IPS calibrado de fábrica AQCOLOR para diseñadores con interruptor KVM integrado, 100% Rec.709, sRGB, DualView, diseño ergonómico, tecnología de cuidado ocular",4.5,629.,US$899.00US$899.00,"(2,837)",
VIOTEK GFV22CB - Monitor de juego ultra compacto de 22 pulgadas y 144 Hz | 1080P Full-HD 5ms | FreeSync FPS/RTS compatible con G-Sync | 2X HDMI 0.138 in DP | Política de píxeles muertos de tolerancia cero (VESA),4.5,109.,US$159.99US$159.99,"(3,095)",
"BenQ - Monitor de computadora GL2780 de 27 pulgadas, 1080P FHD 75Hz 1ms para juegos con tecnología patentada de cuidado ocular y brillo adaptable para calidad de imagen y listo para VESA",4.7,149.,US$209.99US$209.99,"(24,028)",Solo queda(n) 3 en stock (hay más unidades en camino).
"Z-Edge - Monitor curvado para juegos de 32 pulgadas 16:9 1920x1080 180Hz 1ms Monitor LED sin marco, AMD Freesync Premium Display Port HDMI Altavoces integrados",4.5,239.,US$299.99US$299.99,(194),
"WESTHOD Extensor de monitor portátil de 12 pulgadas, monitor portátil para laptop, HDMI, USB C, doble pantalla, FHD 1080P, Plug-Play Tri-SScreen para Windows, Chrome, Mac e Switch, funciona con portátiles de 13 a 16 pulgadas",4.2,319.,US$399.00US$399.00,(760),
"ZSCMALLS Monitor portátil de 15.6 pulgadas, pantalla de computadora Full HD USB C Dual Monitor con altavoz, monitor de juegos para PS3 PS4 Xbox Nintendo Raspberry pi",4.3,129.,,"(3,597)",
"Monitor portátil OLED 4K pantalla táctil 15.6 pulgadas USB-C UHD 3840x2160 Multi Touch Auto-Rotación HDR FreeSync Pantalla portátil con función atril, Dual Tipo-C Mini HDMI para laptop, PC, Macbook PS4 Xbox Switch",4.6,699.,,(13),Solo queda(n) 13 en stock (hay más unidades en camino).
"SunFounder Raspberry Pi - Pantalla táctil de 7 pulgadas, HDMI 1024 × 600 USB IPS LCD Monitor de pantalla para Raspberry Pi 400 4 3 Modelo B, 2 Modelo B y 1 Modelo B+, pantalla táctil capacitiva de Windows",4.5,63.,US$100.00US$100.00,(280),
"ELECROW Monitor de pantalla táctil de 8 pulgadas, pantalla LCD portátil HDMI pequeña de 1280 x 800 con puerto HDMI, altavoces integrados alimentados por USB, compatible con PC, Raspberry Pi, Jetson Nano, consolas de juegos",4.4,125.,,(32),
LG - Monitor IPS LED FHD FreeSync de 24 pulgadas 24ML44B-B - Negro,4.6,158.,,(74),Solo queda(n) 4 en stock (hay más unidades en camino).
ViewSonic Elite - Monitor de juegos con ergonomía avanzada FreeSync Premium Eye Care para e-sports,4.6,,,"(1,822)",
"Packard Bell Monitor de juegos 4K de 28 pulgadas, monitor UHD sin marco de 3840 x 2160p, pantalla IPS, 1 ms, 144 Hz, compatible con FreeSync/G-SYNC, LED retroiluminado, montaje VESA, tipo C (65 W PD)/HDMI/DP/USB, soporte ergonómico",4.1,504.,,(7),
"Hosyond Pantalla táctil TFT LCD SPI de 3.5 pulgadas 480 x 320 pulgadas para Raspberry Pi A, B, A+, B+, 2B, 3B, 3B+,4B",3.8,16.,,(4),
"HTNZIRL Monitor USB C, monitor de juegos G-SYNC de 24 pulgadas, monitor de PC con FHD 1080P 75Hz, pantalla sin marco, IPS, AMD FreeSync, monitor USB-C con entrega de energía de 15 W, VESA, ajuste de inclinación (puerto USB-C/HDMI/DP/USB",4.1,119.,,(22),
"AOPEN Monitor de juegos TN Full HD (1920 x 1080) 25MH1Q Pbipx de 24.5 pulgadas con tecnología AMD Radeon FreeSync, 144Hz, 1ms, (HDMI y puerto de pantalla), negro, FHD (1920 x 1080) 165Hz",4.4,159.,,(284),Solo queda(n) 14 en stock (hay más unidades en camino).
"SAMSUNG Monitor FHD de 24 pulgadas con diseño sin bisel, LS24R350FHNXZA, azul oscuro gris",4.6,138.,US$149.99US$149.99,"(1,436)",
"SAMSUNG S31A Series - Monitor de computadora FHD 1080p de 24 pulgadas, HDMI, VGA (D-Sub), compatible con VESA, modo libre de parpadeo, modo de ahorro de ojos (LS24A310NHNXZA)",4.6,204.,,(485),
"FULLCOM - Nueva pantalla de repuesto LED mate IPS FHD 1080P para portátil de 15.6 pulgadas, pantalla de repuesto LCD, compatible con B156HAN02.1 B156HAN02.1 HW0A B156HAN02.1 HW1A (sin táctil)",4.3,50.,,(50),
"Dragon Touch Portátil 4K – Monitor de juegos IPS HDR de 15.6 pulgadas, 100% sRGB FreeSync con altavoces, VESA compatible con Xbox PS4 Nintendo Switch, laptop, PC, teléfono, Mac Surface (no pantalla táctil)",4.2,224.,US$299.99US$299.99,(485),
"HONGO Monitor portátil para portátil de 15.6 pulgadas, Full HD 1080P, monitor de computadora dual USB C HDMI con altavoces, monitor de viaje plano para MacBook Pro PS4 PS5 PC, cubierta inteligente y protector de pantalla incluidos",4.3,119.,,"(1,180)",
"VIOTEK GFV24CB - Monitor de juego de 24 pulgadas, 165 Hz (soporta 144 Hz) 1920 x 1080p FHD de alto color 4000:1, contraste 98 % sRGB VA, Panel pantalla cerca de marco sin bisel GSYNC, FreeSync, DisplayPort, HDMI, VESA",4.6,119.,US$179.99US$179.99,(857),
"Eyoyo - Monitor portátil, pantalla táctil de 11.6 pulgadas, pantalla de computadora portátil de 1366 x 768 pulgadas, monitor portátil USB C HDMI, monitor de ojos con pantalla IPS de 178°, monitor externo para laptop, PC, teléfono, Mac, Xbox PS4",3.9,127.,US$149.99US$149.99,(21),Solo queda(n) 14 en stock (hay más unidades en camino).
"3M Filtro de privacidad de alta claridad para monitor de pantalla ancha de 24.0"" (16:10) (HC240W1B)",4.3,72.,US$140.55US$140.55,(54),
"ZFTVNIE Monitor de computadora, monitor LED Full HD de 21.5 pulgadas 1920 x 1080P (sin marco, 75Hz, 3ms, VESA, HDMI y puertos VGA), monitor de PC para portátil Xbox Ones",3.9,79.,,(57),
"BesLif 24 W, 23.8 W, 23.6 W, 23 W, iMac24 Actualización compatible con clip para colgar, filtro de privacidad protector de pantalla panorámica de 21.65 pulgadas de ancho x 13.77 pulgadas de alto, tipo de marco de escritorio para monitor (filtro diagonal de 24 pulgadas)",4.2,53.,,(66),Solo queda(n) 2 en stock (hay más unidades en camino).
"Z-Edge UG34W Monitor para juegos de 34 pulgadas, frecuencia de actualización de 165 Hz/tiempo de respuesta de 1 ms, monitor ultra ancho sin marco, pantalla de 3440 x 1440, relación de aspecto 21:9, tecnología AMD FreeSync (2 puertos de pantalla y puerto HDMI)",3.8,299.,,(31),
OMEN 27i Monitor,4.6,,,(60),
"Acer Laptop Aspire 5 Slim 2022, pantalla Full HD de 15.6 pulgadas, procesador AMD Ryzen 5 5500U Hexa Core, gráficos AMD Radeon Graphics, WiFi 6, teclado retroiluminado, Windows 11 Home (24 GB de RAM | SSD de 1 TB)",4.0,599.,,(16),
"Duex Monitor portátil Plus para laptop, 【Actualización 2023】 píxeles móviles de 13.3 pulgadas Full HD IPS Dual Monitor para portátiles, pantalla portátil Plug and Play alimentada por USB C/USB A, compatible con Windows/Apple",4.2,299.,,(129),
"Acer Nitro XV252Q Zbmiiprx 24.5"" Full HD (1920 x 1080) IPS Zero-Frame FreeSync Premium Monitor de juegos, DisplayHDR400, 99% sRGB, hasta 280Hz, hasta 0.5ms (Display Port & 2 puertos HDMI 2.0), color negro",4.0,271.,US$379.99US$379.99,(15),
