Title,Rating,Price,Price_Anterior,Votante,Demanda
"WESTHOD Extensor de monitor portátil de 12 pulgadas, monitor portátil para laptop, HDMI, USB C, doble pantalla, FHD 1080P, Plug-Play Tri-SScreen para Windows, Chrome, Mac e Switch, funciona con portátiles de 13 a 16 pulgadas",4.2,319.,US$399.00US$399.00,(760),
"Z-Edge - Monitor curvado para juegos de 32 pulgadas 16:9 1920x1080 180Hz 1ms Monitor LED sin marco, AMD Freesync Premium Display Port HDMI Altavoces integrados",4.5,239.,US$299.99US$299.99,(194),
"Packard Bell AirFrame - Paquete de 2 monitores de escritorio con bisel ultra delgado de 24 pulgadas, FHD 1920 x 1080p, 75 Hertz, 5 milisegundos, montaje VESA, ajuste de inclinación, HDMI y VGA para uso doméstico y oficina",4.1,249.,,(374),
"Sceptre E205W-16003R - Monitor LED ultradelgado sin marco, con HDMI, VGA, altavoces integrados, color negro metálico 2018",4.6,99.,US$119.97US$119.97,"(25,831)",Solo queda(n) 2 en stock (hay más unidades en camino).
"HP Monitor FHD de 24 mh - Monitor de computadora con pantalla IPS de 23,8 pulgadas (1080p) - Altavoces incorporados y montaje VESA - Ajuste de altura / inclinación para visualización ergonómica - HDMI y DisplayPort - (1D0J9AA # ABA)",4.7,177.,,"(23,716)",
"Acer SB220Q bi - Monitor de 21.5 pulgadas Full HD (1920 x 1080), monitor IPS Ultra delgado, diseño Zero Frame sin marco (puertos HDMI y VGA), color negro",4.6,89.,US$99.99US$99.99,"(41,210)",
"Sceptre 20 ""1600x900 75Hz Monitor LED ultradelgado 2x HDMI VGA Altavoces incorporados, Negro Máquina Amplio ángulo de visión 170 ° (horizontal) / 160 ° (vertical)",4.5,66.,US$89.97US$89.97,"(25,807)",
"KYY Monitor portátil de 15.6 pulgadas, 1080P, FHD USB-C, monitor de computadora HDMI, monitor de juegos HDR IPS con cubierta inteligente y altavoces de primera calidad, monitor externo para laptop, PC, Mac, teléfono, PS4, Xbox Switch",4.6,149.,US$219.99US$219.99,"(4,136)",
"KOORUI Monitor de computadora de 24 pulgadas Full HD 1920 x 1080p, pantalla VA de 75 Hz 3000:1 relación de contraste con HDMI, VGA, sin marco, montaje VESA de 2.953 x 2.953 in, inclinación ergonómica, color negro",4.3,96.,US$121.99US$121.99,"(2,075)",
"Dell Monitor FHD de 24 pulgadas (1920 x 1080) relación 16:9 con Comfortview (certificado TUV), frecuencia de actualización de 75 Hz, 16.7 millones de colores, pantalla antirreflejos con dureza 3H, color negro - SE2422HX",4.6,,,"(1,947)",
"SAMSUNG Monitor de juegos ultra ancho SJ55W de 34 pulgadas (LS34J550WQNXZA) – Actualización de 75Hz, monitor de computadora WQHD, resolución de 3440 x 1440p, respuesta de 4 ms, FreeSync, pantalla dividida, HDMI, negro",4.4,287.,US$329.99US$329.99,"(2,152)",Solo queda(n) 1 en stock (hay más unidades en camino).
"Monitor Sceptre para juegos, curvado, de 30 pulgadas, 21:9 2560x1080, ultra ancho, ultra delgado, HDMI, DisplayPort, hasta 200Hz, altavoces integrados, metal negro, C305B-200UN",4.6,199.,US$254.97US$254.97,"(9,385)",
"VIOTEK GFV24CB - Monitor de juego de 24 pulgadas, 165 Hz (soporta 144 Hz) 1920 x 1080p FHD de alto color 4000:1, contraste 98 % sRGB VA, Panel pantalla cerca de marco sin bisel GSYNC, FreeSync, DisplayPort, HDMI, VESA",4.6,119.,US$179.99US$179.99,(857),
"ZSCMALLS Monitor portátil de 15.6 pulgadas, pantalla de computadora Full HD USB C Dual Monitor con altavoz, monitor de juegos para PS3 PS4 Xbox Nintendo Raspberry pi",4.3,129.,,"(3,597)",
"Dragon Touch Portátil 4K – Monitor de juegos IPS HDR de 15.6 pulgadas, 100% sRGB FreeSync con altavoces, VESA compatible con Xbox PS4 Nintendo Switch, laptop, PC, teléfono, Mac Surface (no pantalla táctil)",4.2,224.,US$299.99US$299.99,(485),
"Sceptre - Monitor curvo de 24 pulgadas, 75Hz, LED, para videojuegos, Full HD, 1080P, HDMI, VGA, con altavoces, montaje de pared VESA listo para usar, metal negro (C248W-1920RN)",4.6,109.,,"(17,410)",
"MNN Portable Monitor 15.6inch FHD 1080P Laptop Monitor USB C HDMI Gaming Ultra-Slim IPS Display w/Smart Cover & Speakers,HDR Plug&Play, External Monitor for Laptop PC Phone Mac Xbox PS5/PS4 Switch",4.8,141.,US$199.99US$199.99,"(1,056)",
"Dell S2722QC Monitor 4K USB-C de 27 pulgadas, pantalla UHD (3840 x 2160), frecuencia de actualización de 60 Hz, tiempo de respuesta de 8 MS de color gris a gris (modo normal), altavoces duales de 3 W integrados, 1.07 mil millones de colores, plata platino",4.3,,,(900),
"LG UltraGear QHD - Monitor para juegos de 27 pulgadas 27GL83A-B - IPS 1ms (GtG), con compatibilidad HDR 10, NVIDIA G-SYNC y AMD FreeSync, 144Hz, negro",4.7,246.,US$299.99US$299.99,"(10,055)",
"LG UltraWide QHD - Monitor curvado para computadora de 34 pulgadas 34WQ73A-B, IPS con compatibilidad HDR 10, KVM integrado y USB tipo C, negro",4.6,469.,,"(3,801)",Solo queda(n) 3 en stock (hay más unidades en camino).
"InnoView Monitor portátil, 15.8 pulgadas FHD 1080P USB C HDMI segundo monitor externo para laptop, escritorio, MacBook, teléfonos, tableta, PS5/4, Xbox, Switch, altavoz integrado con funda protectora",4.5,179.,,"(2,542)",
"Dell Juegos curvos, monitor curvado de 34 pulgadas con frecuencia de actualización de 144 Hz, pantalla WQHD (3440 x 1440), color negro - S3422DWG",4.6,,,"(3,801)",
"Dell Monitor 24 - P2422H - Full HD 1080p, tecnología IPS, tecnología ComfortView Plus",4.5,195.,,(477),Solo queda(n) 6 en stock (hay más unidades en camino).
Acer 27.0” 1920 x 1080 VA Zero-Frame Office Home Computer Monitor - AMD FreeSync - 75Hz Refresh - 1ms VRB - Low Blue Light Filter - Tilt and VESA Compatible - HDMI Port 1.4 & VGA Port KB272HL Hbi,4.6,119.,US$159.99US$159.99,"(1,411)",
"LG 32 pulgadas Full HD IPS, Negro",4.6,199.,,"(2,612)",
"ARZOPA Monitor portátil, 15.6 pulgadas 1080P FHD monitor USB C HDMI pantalla de computadora HDR cuidado de ojos pantalla externa con cubierta inteligente para PC, Mac, teléfono, Xbox Switch PS5",4.4,188.,,"(3,596)",
"Dell S2421HS Full HD 1920 x 1080, LED 1080p de 24 pulgadas, 75Hz, monitor de escritorio con soporte ajustable, tiempo de respuesta de 4 ms de color gris a gris, AMD FreeSync, tecnología IPS, HDMI, DisplayPort, plateado",4.7,,,(573),
"LG - Pantalla 27UN850-W ultra delgada UHD (3840 x 2160), IPS VESA DisplayHDR 400, sRGB 99% color, USB-C con entrega de energía de 60W, diseño prácticamente sin bordes, altura/pivote/inclinación ajustable",4.6,372.,US$479.99US$479.99,"(1,645)",
"HP Monitor Full HD de 27 horas, diagonal, panel IPS y frecuencia de actualización de 75 Hz, pantalla suave, bisel de microborde de 3 lados, ajuste de altura/inclinación de 3.937 in, altavoces duales integrados, para trabajadores híbridos",4.6,159.,,"(4,201)",Solo queda(n) 4 en stock (hay más unidades en camino).
"Dell S2721QS Monitor de bisel ultrafino IPS 4K UHD (3840 x 2160) de 27 pulgadas, AMD FreeSync (HDMI, DisplayPort), certificado VESA, plateado",4.4,,,"(2,359)",
"HONGO Monitor portátil para portátil de 15.6 pulgadas, Full HD 1080P, monitor de computadora dual USB C HDMI con altavoces, monitor de viaje plano para MacBook Pro PS4 PS5 PC, cubierta inteligente y protector de pantalla incluidos",4.3,119.,,"(1,180)",
"Z-Edge U27P4K Monitor para juegos de 27 pulgadas Ultra HD 4K, frecuencia de actualización de 60Hz, monitor LED IPS 3840x2160, 300 cd/m², HDMIx2+DPx1, altavoces integrados, tecnología FreeSync",4.3,219.,,(265),
"Paquete de 2 monitores LCD individuales para computadora, soporte de escritorio independiente para pantalla de 13 a 32 pulgadas con giro, altura ajustable, rotación, capacidad para una (1) pantalla de hasta 77 libras (HT05B-201)",4.6,54.,,(421),
"WESTHOD Extensor de monitor portátil de 12 pulgadas, monitor portátil para laptop, HDMI, USB C, doble pantalla, FHD 1080P, Plug-Play Tri-SScreen para Windows, Chrome, Mac e Switch, funciona con portátiles de 13 a 16 pulgadas",4.2,319.,US$399.00US$399.00,(760),
"Z-Edge - Monitor curvado para juegos de 32 pulgadas 16:9 1920x1080 180Hz 1ms Monitor LED sin marco, AMD Freesync Premium Display Port HDMI Altavoces integrados",4.5,239.,US$299.99US$299.99,(194),
"ZSCMALLS Monitor portátil de 15.6 pulgadas, pantalla de computadora Full HD USB C Dual Monitor con altavoz, monitor de juegos para PS3 PS4 Xbox Nintendo Raspberry pi",4.3,129.,,"(3,597)",
"Dell UltraSharp U2723QE - Monitor LCD WLED 4K UHD de 27 pulgadas, 16:9, negro, plateado",4.4,515.,US$779.99US$779.99,(635),
"Sceptre Monitor LED FHD para juegos de 27 pulgadas, 75 Hz, 2 x HDMI VGA, altavoces integrados, ultra delgado de metal negro",4.5,144.,,"(7,282)",
"HP QHD Gaming de 27 pulgadas con ajuste de inclinación/altura con tecnología AMD FreeSync Premium (X27q, modelo 2021)",4.6,279.,US$299.99US$299.99,"(1,187)",Solo queda(n) 3 en stock (hay más unidades en camino).
"ForHelp Monitor portátil profesional FHD de 15.6 pulgadas (1920 x 1080), monitor IPS ultrafino de cero marco con HDMI USB tipo C, altavoces duales. Monitor portátil externo para laptop, Mac, teléfono, PS4, Xbox Switch",4.8,129.,,(319),
"ViewSonic VA2447-MH Monitor Full HD 1080p de 24 pulgadas con bisel ultrafino, sincronización adaptativa, 75Hz, cuidado de los ojos, HDMI, entradas VGA para el hogar y la oficina",4.6,109.,US$139.99US$139.99,(735),
"KOORUI Monitor de computadora de 24 pulgadas -FHD 1080P Monitor de juegos 165Hz VA 1ms FreeSync™ integrado, compatible con G-sync, monitores LED con ultrafino, HDMI X2/DP, compatible con VESA, inclinación ajustable, cuidado de los ojos 24E4",4.4,119.,US$199.99US$199.99,"(1,442)",
"TeamGee Monitor portátil para laptop, pantalla IPS Full HD de 12 pulgadas, extensor de pantalla doble triple monitor, HDMI/USB-A/tipo C Plug and Play para Windows, Chrome y Mac, funciona con portátiles de 13 a 16 pulgadas",4.3,399.,US$439.99US$439.99,(779),
"Samsung - Monitor FreeSync curvo, Full HD, de 23.5 pulgadas con iluminación LED (LC24F396FHNXZA)",4.7,129.,US$189.99US$189.99,"(23,579)",
"Sceptre E205W-16003R - Monitor LED ultradelgado sin marco, con HDMI, VGA, altavoces integrados, color negro metálico 2018",4.5,89.,,"(7,464)",
"Sceptre - Monitor LED curvado de 27 pulgadas, 75Hz, HDMI, VGA altavoces integrados, metal sin bordes, negro 2019 (C275W-1920RN)",4.6,164.,,"(13,062)",
"SAMSUNG UJ59 Series - Monitor de computadora 4K UHD (3840 x 2160) de 32 pulgadas, HDMI, puerto de visualización, modo protector de ojos/libre de parpadeo, FreeSync (LU32J590UQNXZA)",4.3,339.,,"(3,729)",
SAMSUNG Odyssey G7 de 32 pulgadas: monitor curvo para juegos QHD 1000R,4.5,593.,US$799.99US$799.99,"(3,873)",
"VIOTEK GFV24CB - Monitor de juego de 24 pulgadas, 165 Hz (soporta 144 Hz) 1920 x 1080p FHD de alto color 4000:1, contraste 98 % sRGB VA, Panel pantalla cerca de marco sin bisel GSYNC, FreeSync, DisplayPort, HDMI, VESA",4.6,119.,US$179.99US$179.99,(857),
"Dragon Touch Portátil 4K – Monitor de juegos IPS HDR de 15.6 pulgadas, 100% sRGB FreeSync con altavoces, VESA compatible con Xbox PS4 Nintendo Switch, laptop, PC, teléfono, Mac Surface (no pantalla táctil)",4.2,224.,US$299.99US$299.99,(485),
"Sceptre Monitor para juegos de 27 pulgadas 240Hz 1080p AMD FreeSync Premium HDMI DisplayPort, altavoces integrados ajustables en altura negro Gunmetal (E275B-FWD240)",4.6,199.,US$249.97US$249.97,(499),
"HP P22va G4 - Monitor de computadora 1080P de 21.5 pulgadas, pantalla VA antirreflejos Full HD, relación de contraste 3000:1, HDMI, VGA, montaje VESA, modo de luz azul baja, ideal para el hogar y los negocios, negro (modelo 2022)",4.7,119.,US$149.99US$149.99,"(26,000)",
"CRUA Monitor curvado para juegos de 27 pulgadas, 144 hz/165 Hz, Full HD 1080P 1800R, monitor de computadora sin marco, GTG de 1 ms con FreeSync, desenfoque de bajo movimiento, cuidado de los ojos, VESA, DisplayPort, HDMI, negro",4.3,159.,,"(1,564)",
"ViewSonic VA1655 Monitor IPS portátil de 15.6 pulgadas 1080p con ergonomía móvil, USB-C, mini HDMI para el hogar y la oficina",4.4,129.,US$149.99US$149.99,"(2,496)",
"KYY Monitor portátil de 15.6 pulgadas, FHD 1080P, monitor portátil USB C HDMI, monitor para juegos, pantalla IPS ultra delgada con cubierta inteligente y altavoces, Plug & Play, monitor externo para laptop, PC, teléfono, Mac Xbox PS4",4.6,127.,US$199.99US$199.99,"(2,687)",
Acer Nitro KG241Y Sbiip - Monitor de juegos VA Full HD (1920 x 1080) de 23.8 pulgadas | Tecnología AMD FreeSync Premium | Frecuencia de actualización de 165Hz | 1ms (VRB) | Diseño ZeroFrame | 1 puerto de pantalla 1.2 y 2 HDMI 2.0,4.6,119.,US$179.99US$179.99,"(3,651)",
"Acer R240HY bidx de 23.8 pulgadas IPS HDMI DVI VGA (1920 x 1080) monitor panorámico, negro",4.7,109.,US$149.99US$149.99,"(14,838)",
"LG UltraGear QHD - Monitor curvado para juegos de 34 pulgadas 34GP63A-B, VA con compatibilidad HDR 10 y AMD FreeSync Premium, 160Hz, negro",4.6,398.,,"(2,148)",
"Monitor portátil externo, Arzopa de15.6 pulgadas FHD 1080P, IPS, 100% SRGB, entradas USB C, HDMI con cubierta inteligente para computadoras, teléfonos y consolas de videojuegos",4.4,118.,US$189.99US$189.99,"(2,133)",
"LG - Monitor 32UP83A-W 31.5 pulgadas Class UHD (3840 x 2160) IPS con AMD FreeSync, gama de colores DCI-P3 95% con compatibilidad HDR 10 y USB tipo C, inclinación/altura/soporte pivotante - 2021",4.1,399.,US$479.99US$479.99,(240),
"Alienware - Monitor curvado para juegos Quantom Dot-OLED AW3423DW de 34.18 pulgadas, 3440 x 1440 píxeles a 175 Hz, curvatura 1800R, verdadero 0.1 ms de gris a gris, 1 millón:1, relación de contraste, 1.07 mil millones de colores, luz lunar",4.3,"1,499.",,(234),Solo queda(n) 2 en stock (hay más unidades en camino).
"Monitor portátil, QQH 15.6 pulgadas, monitor de viaje portátil para portátil 1080P FHD IPS segunda pantalla, monitor de juegos, pantalla externa USB C HDMI para computadora, teléfono, PC, interruptor MAC PS4, soporte plegable",4.5,129.,,(343),
"SAMSUNG - Monitor curvo Odyssey G55A QHD de 32 pulgadas, 165Hz, 1 ms, FreeSync con HDR 10, diseño futurista para cualquier escritorio (LS32AG550ENXZA)",4.5,400.,,"(7,555)",
"HONGO Monitor portátil para portátil de 15.6 pulgadas, Full HD 1080P, monitor de computadora dual USB C HDMI con altavoces, monitor de viaje plano para MacBook Pro PS4 PS5 PC, cubierta inteligente y protector de pantalla incluidos",4.3,119.,,"(1,180)",
"Packard Bell AirFrame - Paquete de 2 monitores de escritorio con bisel ultra delgado de 24 pulgadas, FHD 1920 x 1080p, 75 Hertz, 5 milisegundos, montaje VESA, ajuste de inclinación, HDMI y VGA para uso doméstico y oficina",4.1,249.,,(374),
"Sceptre - Monitor curvo de 24 pulgadas, 75Hz, LED, para videojuegos, Full HD, 1080P, HDMI, VGA, con altavoces, montaje de pared VESA listo para usar, metal negro (C248W-1920RN)",4.6,109.,,"(17,410)",
"Z-Edge - Monitor curvado para juegos de 32 pulgadas 16:9 1920x1080 180Hz 1ms Monitor LED sin marco, AMD Freesync Premium Display Port HDMI Altavoces integrados",4.5,239.,US$299.99US$299.99,(194),
"WESTHOD Extensor de monitor portátil de 12 pulgadas, monitor portátil para laptop, HDMI, USB C, doble pantalla, FHD 1080P, Plug-Play Tri-SScreen para Windows, Chrome, Mac e Switch, funciona con portátiles de 13 a 16 pulgadas",4.2,319.,US$399.00US$399.00,(760),
"ZSCMALLS Monitor portátil de 15.6 pulgadas, pantalla de computadora Full HD USB C Dual Monitor con altavoz, monitor de juegos para PS3 PS4 Xbox Nintendo Raspberry pi",4.3,129.,,"(3,597)",
"Acer Monitor de computadora Full HD de 23.8 pulgadas (1920 x 1080) con tecnología AMD Radeon FreeSync, 75Hz, 1ms (VRB) (puerto HDMI 1.4 y puerto VGA) K242HYL Hbi",4.5,94.,US$129.99US$129.99,"(5,979)",
"LG Pantalla IPS Full HD de 27 pulgadas (1920 x 1080) de 27 pulgadas con diseño prácticamente sin bordes de 3 lados, AMD FreeSync y control en pantalla, color negro",4.6,,,(833),
"Sceptre Monitor LED profesional curvo de 24 pulgadas 75 Hz 1080p 98% sRGB HDMI VGA altavoces integrados, color negro máquina 2021",4.6,,,"(4,289)",
"ASUS VA24DQ 23.8” Monitor, 1080P Full HD, 75Hz, IPS, Adaptive-Sync/FreeSync, Eye Care, HDMI DisplayPort VGA, Frameless, VESA Wall Mountable",4.7,129.,US$149.00US$149.00,"(1,230)",
"ASUS - Monitor para juegos VG248QZ de 24"", Negro",4.7,188.,,"(6,699)",
"LG 32QK500-C 32"" Class QHD LED IPS Monitor",4.7,239.,US$279.99US$279.99,"(4,169)",
"SAMSUNG CJ79 Series ViewFinity Ultrawide QHD (3440x1440) Monitor de computadora, 100Hz, Thunderbolt 3 Daisy Chain, QLED, HDMI, USB Hub, soporte ajustable en altura (LC34J791WTNXZA), blanco",4.5,650.,,"(1,660)",
"Monitor de computadora BenQ GW2480 IPS 1080P FHD de 24 pulgadas con altavoces integrados, tecnología patentada de cuidado de los ojos, brillo adaptable para calidad de imagen, bisel ultra delgado y pantalla de borde a borde",4.7,119.,US$179.99US$179.99,"(24,028)",
"ASUS ProArt Display PA278QV Monitor WQHD de 27 pulgadas (2560 x 1440), 100% sRGB/Rec. 709 & E < 2, IPS, DisplayPort HDMI DVI-D Mini DP, Calman Verified Cuidado, Antirreflejos, inclinación pivotante giratorio altura ajustable",4.7,289.,US$319.00US$319.00,"(2,022)",
"SAMSUNG Monitor de computadora S80A, 4K de 27 pulgadas, vertical, USB C, HDR10 (1 mil millones de colores), altavoces integrados (LS27A800UNNXZA)",4.2,309.,,(586),
"Arzopa Monitor portátil de 14 pulgadas, monitor portátil ultra delgado FHD 1080P pantalla externa con altavoces duales, segunda pantalla para laptop, PC, teléfono, Xbox PS4/5, interruptor inteligente incluida",4.4,158.,US$179.99US$179.99,(805),
Acer Nitro XV272U Vbmiiprx - Monitor para juegos WQHD 2560 x 1440 con marco cero de 27 pulgadas | AMD FreeSync Premium | Agile-Splendor IPS | Overclock a 170Hz | Hasta 0.5ms | 95% DCI-P3 | 1 puerto de pantalla y 2 x HDMI 2.0,4.6,249.,US$299.99US$299.99,"(3,110)",
"Dragon Touch Portátil 4K – Monitor de juegos IPS HDR de 15.6 pulgadas, 100% sRGB FreeSync con altavoces, VESA compatible con Xbox PS4 Nintendo Switch, laptop, PC, teléfono, Mac Surface (no pantalla táctil)",4.2,224.,US$299.99US$299.99,(485),
"HONGO Monitor portátil para portátil de 15.6 pulgadas, Full HD 1080P, monitor de computadora dual USB C HDMI con altavoces, monitor de viaje plano para MacBook Pro PS4 PS5 PC, cubierta inteligente y protector de pantalla incluidos",4.3,119.,,"(1,180)",
"VIOTEK GFV24CB - Monitor de juego de 24 pulgadas, 165 Hz (soporta 144 Hz) 1920 x 1080p FHD de alto color 4000:1, contraste 98 % sRGB VA, Panel pantalla cerca de marco sin bisel GSYNC, FreeSync, DisplayPort, HDMI, VESA",4.6,119.,US$179.99US$179.99,(857),
Monitor LG Full HD IPS UltraWide,4.6,146.,US$199.99US$199.99,"(2,296)",
"Lepow Monitor portátil de 15.6 pulgadas, Full HD 1080P, USB tipo C, pantalla IPS para el cuidado de los ojos con altavoces HDMI tipo C para laptop, PC, PS4, Xbox, teléfono incluido, cubierta inteligente y protector de pantalla, color negro",4.3,189.,US$249.99US$249.99,"(11,065)",
"SANSUI Monitor de PC FHD de 24 pulgadas con USB tipo C, auriculares con altavoces integrados, ultra delgado, ergonómico, inclinación, cuidado de ojos de 75 Hz con HDMI VGA para oficina en casa (cable ES-24F1 tipo C y cable HDMI incluido)",4.4,119.,,(426),
HP M27fwa Monitor retroiluminado LED FHD IPS de 27 pulgadas con audio color blanco,4.6,184.,US$289.99US$289.99,(398),
"ZSCMALLS Monitor portátil de 15.6 pulgadas, pantalla de computadora Full HD USB C Dual Monitor con altavoz, monitor de juegos para PS3 PS4 Xbox Nintendo Raspberry pi",4.3,129.,,"(3,597)",
"Soporte de monitor dual: elevador de monitor vertical independiente para dos pantallas de 13 a 34 pulgadas con giro, inclinación, altura ajustable, capacidad para una (1) pantalla de hasta 44 libras HT05B-002",4.7,44.,,"(2,457)",
"KOORUI Monitor de computadora de 22 pulgadas, pantalla de escritorio FHD 1080P, bisel ultrafino/cuidado de los ojos/inclinación ergonómica, puertos HDMI VGA Monitor LED para PC, montaje VESA",4.4,76.,US$99.99US$99.99,"(2,105)",
"QQH Monitor portátil, monitor de 15.6 pulgadas para computadora portátil FHD 1080P USB C pantalla IPS segunda pantalla, mini monitor HDMI para juegos con cubierta inteligente, altavoces duales monitor externo para teléfono PC MAC Xbox PS4",4.6,139.,US$159.99US$159.99,(345),
"LG 32GN650-B Ultragear Monitor para juegos de 32 pulgadas QHD (2560 x 1440), frecuencia de actualización de 165 Hz, 1 ms MBR, HDR 10, sRGB 95% gama de colores, AMD FreeSync - Negro",4.6,276.,US$349.99US$349.99,"(1,394)",Solo queda(n) 20 en stock (hay más unidades en camino).
"ASUS ZenScreen - Monitor portátil 1080P de 15.6 pulgadas (MB16ACV) - Full HD, IPS, cuidado de los ojos, sin parpadeo, filtro de luz azul, soporte, suministro de energía USB-C, para laptop, PC, teléfono, consola, negro",4.4,204.,,"(4,884)",
"LG Monitor para juegos Ultragear 27GP850-B de 27 pulgadas QHD (2560 x 1440) Nano IPS, tiempo de respuesta de 1 ms, frecuencia de actualización de 165 Hz, compatible con NVIDIA G-SYNC, AMD FreeSync Premium, soporte ajustable inclinación/altura/pivote",4.6,429.,,"(1,180)",
"ViewSonic Monitor VA2456-MHD IPS 1080p de 24 pulgadas con biseles ultrafinos, HDMI, DisplayPort y entradas VGA para el hogar, la oficina",4.6,129.,US$169.99US$169.99,"(1,306)",
"Sceptre Monitor para juegos de 27 pulgadas 240Hz 1080p AMD FreeSync Premium HDMI DisplayPort, altavoces integrados ajustables en altura negro Gunmetal (E275B-FWD240)",4.6,199.,US$249.97US$249.97,(499),
"Packard Bell AirFrame - Paquete de 2 monitores de escritorio con bisel ultra delgado de 24 pulgadas, FHD 1920 x 1080p, 75 Hertz, 5 milisegundos, montaje VESA, ajuste de inclinación, HDMI y VGA para uso doméstico y oficina",4.1,249.,,(374),
"Sceptre - Monitor curvo de 24 pulgadas, 75Hz, LED, para videojuegos, Full HD, 1080P, HDMI, VGA, con altavoces, montaje de pared VESA listo para usar, metal negro (C248W-1920RN)",4.6,109.,,"(17,410)",
"Z-Edge - Monitor curvado para juegos de 32 pulgadas 16:9 1920x1080 180Hz 1ms Monitor LED sin marco, AMD Freesync Premium Display Port HDMI Altavoces integrados",4.5,239.,US$299.99US$299.99,(194),
"WESTHOD Extensor de monitor portátil de 12 pulgadas, monitor portátil para laptop, HDMI, USB C, doble pantalla, FHD 1080P, Plug-Play Tri-SScreen para Windows, Chrome, Mac e Switch, funciona con portátiles de 13 a 16 pulgadas",4.2,319.,US$399.00US$399.00,(760),
"ZSCMALLS Monitor portátil de 15.6 pulgadas, pantalla de computadora Full HD USB C Dual Monitor con altavoz, monitor de juegos para PS3 PS4 Xbox Nintendo Raspberry pi",4.3,129.,,"(3,597)",
"Acer CB272 bmiprx Monitor profesional de oficina en casa de 27 pulgadas Full HD (1920 x 1080) IPS Zero Frame con sincronización gratuita AMD Radeon, soporte ajustable de altura con inclinación y pivote | Pantalla, puertos HDMI y VGA, altavoces",4.4,149.,US$179.99US$179.99,"(2,867)",
"AOC CU34G2X 34 ""Monitor de juego inmersivo sin marco de"" CU34G2X, ultrawide QHD 3440x1440, panel VA, 1MS 144HZ Sincronización adaptable, altura ajustable, 3-año Zero píxeles muertos",4.7,399.,,"(19,281)",
LG 32GN63T-B Ultragear QHD 165Hz HDR10 Monitor con compatibilidad NVIDIA G-SYNC y AMD FreeSync Premium (renovado),4.5,239.,US$324.53US$324.53,(440),
"Monitor portátil USB-C - Pantalla de computadora FHD HDR FreeSync Zero Frame USB-C de 15.6 pulgadas con doble tipo C Mini HDMI para laptop, PC, Mac, superficie Xbox PS4/5, con cubierta inteligente",4.8,199.,,"(4,116)",
"Sceptre IPS - Monitor de computadora de negocios de 24 pulgadas, 1080p 75Hz con altavoces integrados HDMI VGA, color negro máquina (E248W-FPT)",4.6,115.,,"(4,114)",
"Sceptre Monitor LED IPS para juegos de 27 pulgadas de hasta 165 Hz 144 Hz 1 ms DisplayPort HDMI, FreeSync FPS RTS altavoces integrados, color negro plomizo 2022 (E275B-FPT165)",4.5,149.,US$199.97US$199.97,"(1,014)",
"LG FHD - Monitor de computadora de 24 pulgadas 24MP400-B, IPS con AMD FreeSync, negro",4.6,,,(449),
"Monitor LED de 21.5 pulgadas, de la marca Samsung, serie CF390, modelo LC22F390FHXZA, Negro 24 - pulgadas",4.6,,,"(3,263)",
ASUS Monitor de Gaming TUF 144Hz 1ms Eye Sync Care HDMI,4.6,329.,,"(7,898)",
"ASUS TUF Gaming VG27VH1B 27"" Monitor curvo, 1080P Full HD, 165Hz (soporta 144Hz), Freesync, 1ms, Extreme Low Motion Blur, sincronización adaptativa, FreeSync Premium, Eye Care (Desenfoque de movimiento extremo), HDMI D-Sub, negro",4.7,199.,,"(1,591)",
"GIGABYTE M32U - Monitor de juegos compatible con FreeSync 4K de 32 pulgadas, 144 Hz, SS IPS, pantalla 3840 x 2160, tiempo de respuesta de 1 ms (MPRT), 1 puerto de pantalla 1.4, 2 HDMI 2.1, 3 USB 3.0, 1 USB tipo C",4.4,729.,,"(3,680)",
"Sceptre Monitor para juegos de 27 pulgadas 240Hz 1080p AMD FreeSync Premium HDMI DisplayPort, altavoces integrados ajustables en altura negro Gunmetal (E275B-FWD240)",4.6,199.,US$249.97US$249.97,(499),
"Dragon Touch Portátil 4K – Monitor de juegos IPS HDR de 15.6 pulgadas, 100% sRGB FreeSync con altavoces, VESA compatible con Xbox PS4 Nintendo Switch, laptop, PC, teléfono, Mac Surface (no pantalla táctil)",4.2,224.,US$299.99US$299.99,(485),
"HONGO Monitor portátil para portátil de 15.6 pulgadas, Full HD 1080P, monitor de computadora dual USB C HDMI con altavoces, monitor de viaje plano para MacBook Pro PS4 PS5 PC, cubierta inteligente y protector de pantalla incluidos",4.3,119.,,"(1,180)",
"VIOTEK GFV24CB - Monitor de juego de 24 pulgadas, 165 Hz (soporta 144 Hz) 1920 x 1080p FHD de alto color 4000:1, contraste 98 % sRGB VA, Panel pantalla cerca de marco sin bisel GSYNC, FreeSync, DisplayPort, HDMI, VESA",4.6,119.,US$179.99US$179.99,(857),
"SAMSUNG Monitor de computadora FHD 1080p de la serie T35F de 27 pulgadas, 75Hz, panel IPS, HDMI, VGA (D-Sub), sin borde de 3 lados, FreeSync (LF27T350FHNXZA)",4.6,149.,US$219.99US$219.99,"(2,771)",Solo queda(n) 6 en stock (hay más unidades en camino).
"LG UltraWide QHD - Monitor de computadora de 34 pulgadas 34WP65C-B, VA con compatibilidad HDR 10 y AMD FreeSync Premium, color negro",4.6,499.,,(809),
"SAMSUNG Odyssey Neo G8 4K UHD 240Hz 1ms G-Sync 1000R - Monitor curvado para juegos, Quantum HDR2000, AMD FreeSync Premium Pro, pantalla mate, vista de juego ultraancha, DisplayPort, HDMI, negro y blanco, 2022",4.1,"1,344.","US$1,499.99US$1,499.99",(974),
